{
  "interface": "lossless-stem-v1",
  "track_id": "00000000-0000-4000-8000-000000000001",
  "generation": 1,
  "source": {
    "object_key": "tracks/00000000-0000-4000-8000-000000000001/1/source/source.mp4",
    "sha256": "0000000000000000000000000000000000000000000000000000000000000000"
  },
  "separation": {
    "model": "htdemucs_6s",
    "model_version": "example-model-version",
    "worker_image": "ghcr.io/mdc159/shizzle-worker@example-digest",
    "sample_rate_hz": 44100,
    "channels": 2,
    "sample_format": "f32le",
    "start_sample": 0,
    "sample_count": 13230000
  },
  "stems": [
    {
      "role": "vocals",
      "file": "stems/vocals.wav",
      "bytes": 105840044,
      "sha256": "1111111111111111111111111111111111111111111111111111111111111111"
    },
    {
      "role": "drums",
      "file": "stems/drums.wav",
      "bytes": 105840044,
      "sha256": "2222222222222222222222222222222222222222222222222222222222222222"
    },
    {
      "role": "bass",
      "file": "stems/bass.wav",
      "bytes": 105840044,
      "sha256": "3333333333333333333333333333333333333333333333333333333333333333"
    },
    {
      "role": "guitar",
      "file": "stems/guitar.wav",
      "bytes": 105840044,
      "sha256": "4444444444444444444444444444444444444444444444444444444444444444"
    },
    {
      "role": "piano",
      "file": "stems/piano.wav",
      "bytes": 105840044,
      "sha256": "5555555555555555555555555555555555555555555555555555555555555555"
    },
    {
      "role": "shizzle",
      "file": "stems/shizzle.wav",
      "bytes": 105840044,
      "sha256": "6666666666666666666666666666666666666666666666666666666666666666"
    }
  ]
}
